{
    "comment": "Generated manually",
    "userTable": "usuarios",
    "idAccessor": "id",
    "usernameAccessor": "username",
    "nameAccessor": "nome_abreviado",
    "roleAccessor": "tipo_permissao",
    "roles": {
        "usuario": {
            "value": 1,
            "scope": { "field": "clinica_id", "op": "==", "value": "$user.clinica_id" },
            "views": {
                "clinicas": {
                    "rules": {
                        "browse": true,
                        "detail": true,
                        "edit": false,
                        "add": false,
                        "delete": false
                    },
                    "scope": "id == $user.clinica_id"
                },
                "usuarios": {
                    "rules": {
                        "browse": true,
                        "detail": true,
                        "edit": "id == $user.id",
                        "add": false,
                        "delete": false
                    },
                    "fields": {
                        "clinica_id": { "readOnly": true },
                        "tipo_permissao": {
                            "readOnly": true,
                            "filter": { "op": "==", "value": 1 }
                        }
                    }
                },
                "pacientes": {
                    "rules": {
                        "browse": true,
                        "detail": true,
                        "edit": { "field": "usuario_id", "op": "==", "value": "$user.id" },
                        "add": { "field": "usuario_id", "op": "==", "value": "$user.id" },
                        "delete": false
                    }
                },
                "projetos": {
                    "rules": {
                        "browse": true,
                        "detail": true,
                        "edit": "usuario_id == $user.id",
                        "add": "usuario_id == $user.id",
                        "delete": false
                    }
                }
            }
        },
        "responsavel": {
            "value": 2,
            "scope": "clinica_id == $user.clinica_id",
            "views": {
                "clinicas": {
                    "rules": {
                        "browse": true,
                        "detail": true,
                        "edit": true,
                        "add": false,
                        "delete": false
                    },
                    "scope": "id == $user.clinica_id"
                },
                "usuarios": {
                    "rules": {
                        "browse": true,
                        "detail": true,
                        "edit": true,
                        "add": true,
                        "delete": true
                    },
                    "fields": {
                        "tipo_permissao": "tipo_permissao <= 2"
                    }
                },
                "pacientes": {
                    "rules": {
                        "browse": true,
                        "detail": true,
                        "edit": true,
                        "add": true,
                        "delete": true
                    }
                },
                "projetos": {
                    "rules": {
                        "browse": true,
                        "detail": true,
                        "edit": true,
                        "add": true,
                        "delete": true
                    }
                }
            }
        },
        "administrador": {
            "value": 3,
            "scope": "all",
            "views": {
                "clinicas": {
                    "rules": {
                        "browse": true,
                        "detail": true,
                        "edit": true,
                        "add": true,
                        "delete": true
                    }
                },
                "usuarios": {
                    "rules": {
                        "browse": true,
                        "detail": true,
                        "edit": true,
                        "add": true,
                        "delete": true
                    },
                    "fields": {
                        "tipo_permissao": "tipo_permissao <= 3",
                        "senha": { "visible": true }
                    }
                },
                "pacientes": {
                    "rules": {
                        "browse": true,
                        "detail": true,
                        "edit": true,
                        "add": true,
                        "delete": true
                    }
                },
                "projetos": {
                    "rules": {
                        "browse": true,
                        "detail": true,
                        "edit": true,
                        "add": true,
                        "delete": true
                    }
                }
            }
        },
        "superusuario": {
            "value": 4,
            "scope": "all",
            "views": {
                "clinicas": {
                    "rules": {
                        "browse": true,
                        "detail": true,
                        "edit": true,
                        "add": true,
                        "delete": true
                    }
                },
                "usuarios": {
                    "rules": {
                        "browse": true,
                        "detail": true,
                        "edit": true,
                        "add": true,
                        "delete": true
                    },
                    "fields": {
                        "tipo_permissao": { "readOnly": false },
                        "senha": { "visible": true }
                    },
                    "tabs": {
                        "pacientes": false
                    }
                },
                "pacientes": {
                    "rules": {
                        "browse": true,
                        "detail": true,
                        "edit": true,
                        "add": true,
                        "delete": true
                    }
                },
                "projetos": {
                    "rules": {
                        "browse": true,
                        "detail": true,
                        "edit": true,
                        "add": true,
                        "delete": true
                    }
                }
            }
        }
    }
}